{
  "$schema": "https://raw.githubusercontent.com/migueljnew-droid/spear-framework/main/schemas/config.schema.json",
  "version": "1.0.0",
  "project": {
    "name": "",
    "language": "auto",
    "description": ""
  },
  "phases": {
    "spec": { "enabled": true, "require_approval": true },
    "plan": { "enabled": true, "require_approval": true },
    "execute": { "enabled": true, "require_approval": false },
    "audit": { "enabled": true, "require_approval": false },
    "ratchet": { "enabled": true, "require_approval": false }
  },
  "audit": {
    "categories": {
      "security": { "enabled": true, "block_on": "CRITICAL" },
      "dependencies": { "enabled": true, "block_on": "CRITICAL" },
      "performance": { "enabled": true, "block_on": "HIGH" },
      "code_quality": { "enabled": true, "block_on": "HIGH" },
      "documentation": { "enabled": true, "block_on": "CRITICAL" },
      "architecture": { "enabled": true, "block_on": "HIGH" }
    },
    "parallel": true,
    "auto_fix": false
  },
  "ratchet": {
    "auto_tighten": true,
    "tighten_buffer_percent": 2,
    "improvement_threshold_percent": 5,
    "require_justification_to_loosen": true
  },
  "hooks": {
    "pre_commit": true,
    "commit_msg": true,
    "secrets_scan": true,
    "lint_check": true,
    "fitness_check": true,
    "dependency_audit": true,
    "doc_coverage": true,
    "test_gate": true
  },
  "memory": {
    "backend": "json",
    "auto_index": true,
    "max_entries_per_category": 500
  },
  "adapter": "auto"
}
